,vaga,empresa,localizacao,salario,dataPostagem,dataRaspagem,requisitos,job_url
0,Accenture,Accenture,"São Paulo, SP",,Postedhá 30+ dias,2022-05-06,"Desenvolver, criar e modificar a plataforma ServiceNow para uso do cliente com o objetivo de otimizar a eficiência operacional.",
1,Vagas de emprego: Esferas Software,Esferas Software,"São Paulo, SP",R$ 3.000 por mês,PostedRecém publicada,2022-05-06,"Goste de apreender e compartilhar conhecimentos.Sistema híbrido (geralmente 1 vez por semana presencial na Vila Olímpia, São Paulo - SP).",
2,Vagas de emprego: TradeUp Group,TradeUp Group,"Barueri, SP",R$ 2.500 - R$ 8.500 por mês,PostedRecém publicada,2022-05-06,Desenvolvedor Back end e Full Stack.Capacidade de compreender e questionar requisitos - Capacidade de elaboração de testes automatizados.,
3,Vagas de emprego: KAVAK Careers,KAVAK Careers,"São Paulo, SP",,PostedRecém publicada,2022-05-06,"KAVAK é o N°1 de comércio eletrônico para compra e venda de veículos na América Latina, projetado como uma das maiores empresas da região.",
4,Sinqia,Sinqia,"Home office in São Paulo, SP",,PostedHoje,2022-05-06,"A Sinqia, provedora da experiência mais desejada em tecnologia para o mercado financeiro no Brasil, está em busca de uma Pessoa Desenvolvedora JR para compor…",
5,Vagas de emprego: One Digital,One Digital,"Osasco, SP",,Postedhá 2 dias,2022-05-06,Atividades: Usar linguagem HTML para criar páginas de internet e peças de e-mail marketing de fácil utilização; Manter e aprimorar landing pages; Otimizar…,
6,Softplan,Softplan,"São Paulo, SP",,PostedRecém publicada,2022-05-06,Somos uma das maiores desenvolvedoras de software do país e atuamos diariamente para promover transformações fundamentais na vida de milhares de pessoas que são…,
7,Vagas de emprego: Foster,Foster,"São Paulo, SP",R$ 1.500 - R$ 2.000 por mês,Postedhá 18 dias,2022-05-06,"Foster, empresa do Grupo WPP que atua nos segmentos Web e Mobile, seleciona Estagiário em Programação Front-End.Benefícios Vale-transporte se necessário.",
8,Vagas de emprego: Gen Designs,Gen Designs,"São Paulo, SP",R$ 2.500 - R$ 3.500 por mês,Postedhá 3 dias,2022-05-06,Requisitos Conhecimentos sólidos em: HTML; CSS; Javascript; Hospedagem de sites.Desejável Conhecimentos em Frameworks: React js e Angular.,
9,Vagas de emprego: Targetware Informática,Targetware Informática,"Home office in São Paulo, SP",R$ 4.000 - R$ 5.600 por mês,Postedhá 8 dias,2022-05-06,"Estamos à procura de um desenvolvedor Front End que possa utilizar Bootstrap, HTML5, CSS e Javascript para desenvolver aplicativos, interfaces de usuário…",
10,Vagas de emprego: Clubedodev,Clubedodev,"Home office in Barueri, SP",R$ 3.000 - R$ 6.000 por mês,EmployerAtiva 15 dias atrás,2022-05-06,"O clubedodev é uma pequena empresa em crescimento, que tem o foco em transformar as ideias dos clientes em realidade.Tipo de vaga: Tempo integral, Efetivo CLT.",
11,Vagas de emprego: Martin Luz,Martin Luz,"Home office in São Paulo, SP",R$ 3.500 - R$ 4.000 por mês,PostedHoje,2022-05-06,"A Cashforce é uma startup, especializada na organização financeira e acompanhamento dos fluxos econômicos da cadeia de suprimentos.",
12,Vagas de emprego: Agência Upper,Agência Upper,"São Paulo, SP",R$ 4.000 - R$ 5.000 por mês,PostedHoje,2022-05-06,"A Upper é uma AGÊNCIA DIGITAL, com um ótimo ambiente de trabalho e que preza pelo bem estar e qualidade de vida de nossos colaboradores.",
13,Vagas de emprego: MKT Now,MKT Now,"São Paulo, SP",R$ 1.500 - R$ 2.000 por mês,Postedhá 9 dias,2022-05-06,"Requisitos Desenvolvimento Front-end, html, css; JavaScript; Photoshop; Plataforma Wordpress; Conhecimentos em Framework de desenvolvimento, React JS; Vtex,…",
14,Vagas de emprego: Infotera Tecnologia,Infotera Tecnologia,"São Paulo, SP",R$ 3.000 - R$ 4.000 por mês,EmployerAtiva 10 dias atrás,2022-05-06,"Atuar no desenvolvimento de softwares para o setor de hotelaria e turismo, utilizando: HTML, CSS, PHP, JavaScript/TypeScript, NodeJS, MongoDB, Integração com…",
15,DESENVOLVEDOR FRONT-END JÚNIOR,Infotera Tecnologia,"São Paulo, SP",R$ 3.000 - R$ 4.000 por mês,EmployerAtiva 10 dias atrás,2022-05-06,"Atuar no desenvolvimento de softwares para o setor de hotelaria e turismo, utilizando: HTML, CSS, PHP, JavaScript/TypeScript, NodeJS, MongoDB, Integração com…",https://www.br.indeed.com/company/Infotera-Tecnologia/jobs/Desenvolvedor-Front-End-J%C3%BAnior-d65b560ea44c7529?fccid=ae8f866c46dd46a9&vjs=3
16,Desenvolvedor Full Stack Jr,Talento RH,"Home office in São Paulo, SP",,Postedhá 8 dias,2022-05-06,"Buscamos Desenvolvedor Full Stack Jr para uma empresa no ramo de produção Digital focada em Desenvolvimento de Sites, Hotsites, Landing Pages, Lojas Virtuais .",https://www.br.indeed.com/company/Talento-RH/jobs/Desenvolvedor-Full-Stack-Junior-99dafdf67e5eed1f?fccid=de988f04353bba3b&vjs=3
17,Desenvolvedor(a) Front-End,QuikDev,"São Paulo, SP",,Postedhá 10 dias,2022-05-06,"Se você é um(a) profissional focado no resultado, que sabe trabalhar em equipe e com experiência sólida essa vaga é para você.",https://www.br.indeed.com/rc/clk?jk=3c08ca95f900cefd&fccid=3f9a8b7d0b18c69a&vjs=3
18,Pessoa Desenvolvedora Jr. - Front-end (GER7),PayGo Pagamentos,"São Paulo, SP",,Postedhá 17 dias,2022-05-06,Desenvolvemos softwares para o mercado de meios de pagamento eletrônico.Somos especialistas em software para terminais de cartão de crédito.,https://www.br.indeed.com/rc/clk?jk=7ae7caf7b8cefb39&fccid=86a771524ff50407&vjs=3
19,Estagio Front-end,MadeinWeb Internet Solutions,"São Paulo, SP",,Postedhá 28 dias,2022-05-06,Benefícios Vale-transporte; Cartão Beneficio; Auxilio Home- Office; Gympass.,https://www.br.indeed.com/rc/clk?jk=433e484ad3fbb423&fccid=d288e584fa12fdb8&vjs=3
20,Frontend Engineer,Wildlife Studios,"São Paulo, SP",,PostedRecém publicada,2022-05-06,Work closely to UX designers and backend developers to ensure we are building the best platform possible.Build easy-to-use interfaces that allow game teams to…,https://www.br.indeed.com/company/Wildlife-Studios/jobs/Frontend-Engineer-b15ab7637ee13c5a?fccid=6e28d9f7b9df5105&vjs=3
21,Analista de Desenvolvimento,GRUPO MAIS VALOR,"São Paulo, SP",R$ 3.000 - R$ 6.000 por mês,Postedhá 2 dias,2022-05-06,"NECESSÁRIO: Superior completo ou cursando na área de TI e nível intermediário em javascript, PHP e MySQL.CONHECIMENTO: PHP 7.4, Javascript, HTML, CSS, MySQL …",https://www.br.indeed.com/company/Grupo-Mais-Valor/jobs/Analista-Desenvolvimento-69a2779076b68f1c?fccid=17140619002d0982&vjs=3
22,Desenvolvedor PHP React,Clubedodev,"Home office in Barueri, SP",R$ 3.000 - R$ 8.000 por mês,EmployerAtiva 15 dias atrás,2022-05-06,Conhecimentos em React e React native será diferencial para evolução e promoções futuras.,https://www.br.indeed.com/company/Clubedodev/jobs/Desenvolvedor-PHP-React-f6961518bb3fc8e5?fccid=3eae11ed3cd3f1a4&vjs=3
23,Desenvolvedor Back-End,QuikDev,"Home office in São Paulo, SP",R$ 2.500 - R$ 4.000 por mês,EmployerAtiva 4 dias atrás,2022-05-06,"Determinar o tempo que gastará para realizar cada atividade.- Controle de versões utilizando Git;- JavaScript, API Restfull, Html, CSS;",https://www.br.indeed.com/company/QuikDev/jobs/Desenvolvedor-Back-End-6ce2b4b4622feea4?fccid=3f9a8b7d0b18c69a&vjs=3
24,Dot Net Junior - Vaga Remota,BAXTECH,"São Paulo, SP",R$ 3.000 - R$ 5.000 por mês,EmployerAtiva 1 dia atrás,2022-05-06,"Full Stack, Conhecimentos em C sharp, Javascript, Sql server, Html; CSS.Formação Superior Completa em cursos da área de Tecnologia da Informação.",https://www.br.indeed.com/company/Baxtech/jobs/Dot-Net-Junior-fafff920bfdcae73?fccid=46644f73126273d8&vjs=3
25,Pessoa Desenvolvedora Front-End,Alfa,"Hybrid remote in São Paulo, SP",,Postedhá 18 dias,2022-05-06,Aqui no Alfa estamos sempre em busca de novos talentos para somar ao nosso time que se reúne todos os dias com um único propósito: oferecer as melhores soluções…,https://www.br.indeed.com/rc/clk?jk=6a926215ad19c1dc&fccid=9755681c84ddf713&vjs=3
26,Software Development Engineer II,Amzn Servicos de Varejo do Bra,"São Paulo, SP",,PostedRecém publicada,2022-05-06,"Relevant experience building successful production software systems.Experience with either Java, C++, C#, Python OR Ruby and web technologies (i.e. JavaScript,…",https://www.br.indeed.com/rc/clk?jk=fb7aa265bad6557d&fccid=fe2d21eef233e94a&vjs=3
27,React,Wipro Limited,"São Paulo, SP",,Postedhá 30 dias,2022-05-06,Should have expertise in JQuery and Javascript.Understands technical and functional design requirements and provides efficient client side solutions using HTML…,https://www.br.indeed.com/rc/clk?jk=02004f319fc11863&fccid=8d25321c1defe73f&vjs=3
28,3929 - ANALISTA DE SISTEMAS PL,Sinqia,"Home office in São Paulo, SP",,Postedhá 16 dias,2022-05-06,"NET PL para compor nosso time e nos ajudar a fazer o mercado financeiro pulsar!NET, C#, SQL Server, oracle, Angular entre outras tecnologias.",https://www.br.indeed.com/rc/clk?jk=1eaeceba2648485b&fccid=83849b17246b3c1e&vjs=3
29,Desenvolvedor Power Automate,Edesoft,"São Paulo, SP",,PostedHoje,2022-05-06,"Conhecimento em : Microsoft Power Platform , Javascript, Plugins de ações personalizadas,Microsoft Dataverse, Gateways,Http, Json, HTML, OData, Azure,BI.",https://www.br.indeed.com/rc/clk?jk=474e0d099bdc05c7&fccid=5dea46f48bdafb60&vjs=3
30,Finnet,Finnet,"Home office in São Paulo, SP",,Postedhá 9 dias,2022-05-06,"Todo dia, quando chegamos à Finnet, não queremos apenas trabalhar.Conhecimentos em alguma dessas tecnologias de front (React (NextJS) VUE (NuxtJS), Sass, Html,…",
31,IBM,IBM,"São Paulo, SP",,PostedHoje,2022-05-06,"To think along with clients and sell.This role specializes in performing remote technical support of MQ and MQ Appliance, skills with Linux/Unix and Windows…",
32,Vagas de emprego: StartSe,StartSe,"São Paulo, SP",,Postedhá 7 dias,2022-05-06,"Se você consegue aprender rápido, possui um raciocínio lógico que deixaria o Mestre Yoda com inveja, aqui é o seu lugar.Então venha fazer parte do nosso time.",
33,Vagas de emprego: Somosotech IT Co Limited,Somosotech IT Co Limited,"Home office temporário in São Paulo, SP",R$ 6.500 - R$ 8.000 por mês,PostedHoje,2022-05-06,"We are* looking for a *UX/UI Designer, who is super familiar with WordPress* to turn our websites and plugins into easy-to-use products for our clients.",
34,Class Solutions,Class Solutions,"São Paulo, SP",,Postedhá 30 dias,2022-05-06,"Atuará em atividades de Desenvolvimento de Soluções de Tecnologia da Informação, implementando aplicativos de Celular e Computadores via Microsoft PowerApps,…",
35,Vagas de emprego: Innolevels,Innolevels,"São Paulo, SP",R$ 8.000 - R$ 9.700 por mês,EmployerAtiva 2 dias atrás,2022-05-06,"Se você conhece ou deseja aprendizado em computação em Cloud/Nuvem, criação de microserviços, Rest, SOAP e API Managers/API Gateways, Integração de Design…",
36,Vagas de emprego: 2RP Net,2RP Net,"Home office in São Paulo, SP",,Postedhá 30+ dias,2022-05-06,"Alguma linguagem de programação (C, Java, C#, PHP, etc);Outras linguagens e tecnologias (PHP, C#, Java, Python, Node.js, Golang, etc);",
37,Vagas de emprego: Martin Luz,Martin Luz,"Home office in São Paulo, SP",R$ 3.500 - R$ 4.000 por mês,PostedHoje,2022-05-06,"Contribuir com o desenvolvimento de um novo produto, basicamente do zero;Sempre procuram aprender mais sobre tecnologia;",
38,Santander,Santander,"São Paulo, SP",,PostedHoje,2022-05-06,"Anl Tecnologia e Operações + SAO PAULO, Brazil WHAT YOU WILL BE DOING Responsabilidades e atribuições - Responsável pela parametrização e homologação das…",
39,Vagas de emprego: ATTA BR,ATTA BR,"Home office in São Paulo, SP",R$ 2.500 - R$ 6.000 por mês,EmployerAtiva 2 dias atrás,2022-05-06,"Linguagens e tecnologias: Java, Mysql, CSS, HTML, Javascript.",
40,Vagas de emprego: Bomtrato,Bomtrato,"Home office in São Paulo, SP",,Postedhá 28 dias,2022-05-06,Buscamos pessoas no início ou em transição de carreira na área de desenvolvimento de sistemas com vontade de aprender e crescer junto com o nosso time.,
41,HIT COMMUNICATIONS,HIT COMMUNICATIONS,"Home office in São Paulo, SP",R$ 2.000 - R$ 3.000 por mês,Postedhá 1 dia,2022-05-06,"Possuir conhecimento de HTML, CSS, JavaScript, Design Web, React, TypeScript, WebSockets e aplicativos mobile.",
42,Vagas de emprego: Metal Toad,Metal Toad,"São Paulo, SP",,Postedhá 1 dia,2022-05-06,"This is a fully remote position and contracts with the potential to hire.Designs develop, implement, utilize, and conform architecture application solutions,…",
43,Vagas de emprego: G4 Educação,G4 Educação,"São Paulo, SP",,Postedhá 30+ dias,2022-05-06,Estamos com oportunidade para atuar como Desenvolvedor(a) Full Stack Junior.Propor soluções No-Code / Low-Code;,
44,Sinqia,Sinqia,"Home office in São Paulo, SP",,Postedhá 30+ dias,2022-05-06,"Desenvolvimento frontend em time ágil num produto cross-verticais da Sinqia.Conhecimentos: Angular, Javascript, HTML, CSS, Bootstrap, React, Flutter.",
45,Santander,Santander,"São Paulo, SP",,Postedhá 1 dia,2022-05-06,"Swift (IOS) , Devops (noções), Javascript es5/es6, Typescript, Angular 2+, CSS, Conceitos de Consumo Rest, HTML, Dynatrace (noções).",
46,Vagas de emprego: HUNTER COMERCIAL ELETRONICOS,HUNTER COMERCIAL ELETRONICOS,"São Paulo, SP",R$ 2.000 - R$ 4.000 por mês,Postedhá 1 dia,2022-05-06,"Conhecimentos práticos de CSS3, HTML5 e JavaScript.Experiência em trabalhar com templates WordPress.",
47,Tech Mahindra,Tech Mahindra,"São Paulo, SP",,Postedhá 30+ dias,2022-05-06,"Nós realmente acreditamos que a tecnologia torna isso possível, mas são as pessoas que fazem isso acontecer.",
48,Vagas de emprego: Rino Box,Rino Box,"Home office in São Paulo, SP",,Postedhá 23 dias,2022-05-06,"Conhecimento sólidos em JavaScript com ênfase em um ou mais frameworks: (VueJS, Angular ou React);Conhecimento em HTM5 e CSS/Sass;",
49,vagas de emprego: São Paulo,,"Home office in São Paulo, SP",,Postedhá 4 dias,2022-05-06,"Muitas vezes confundido com um simples pop-up, Allert é um diferenciado canal digital de comunicação interna que envia mensagens diretamente na tela do…",
50,Global TI,Global TI,"São Paulo, SP",,Postedhá 1 dia,2022-05-06,Prestar sustentação/correção e melhorias voltados ao cliente final.,
51,Vagas de emprego: FORCE-LINE INDUSTRIA E COMERCIO DE COMPONENTES ELETRONICOS LTDA,FORCE-LINE INDUSTRIA E COMERCIO DE COMPONENTES...,"São Paulo, SP",,Postedhá 3 dias,2022-05-06,> Desenvolvimento de programas na linguagem Advpl.,
52,IBM,IBM,"São Paulo, SP",,Postedhá 8 dias,2022-05-06,NET Core; Experiência em desenvolvimento com banco de dados Oracle; Conhecimento em frameworks de scripts de desenvolvimento Web para plataformas Windows:…,
53,Vagas de emprego: Medical Harbour Aparelhos Medico-Hospitalares e Servicos em Tecnologia Ltda,Medical Harbour Aparelhos Medico-Hospitalares e...,"Home office in São Paulo, SP",R$ 5.000 - R$ 6.400 por mês,Postedhá 2 dias,2022-05-06,Controle de versionamento de código (Git).Utilização de APIs Rest (JSON).Desenvolvimento e manutenção de projetos web (sistemas/sites/portais).,
54,Vagas de emprego: EMPREGARE.com,EMPREGARE.com,"São Paulo, SP",,PostedHoje,2022-05-06,Descrição: Conhecimentos fundamentais - Linguagem PHP - Linux - Apache - MySQL - HTML5 / CSS3 / JavaScript Requisitos: Conhecimentos desejáveis -…,
55,Vagas de emprego: Exent | Performance Marketing,Exent | Performance Marketing,"Home office in São Paulo, SP",R$ 1.500 - R$ 2.000 por mês,Postedhá 16 dias,2022-05-06,Estamos procurando um(a) Estagiário(a) para atuar no setor de Desenvolvimento Front-end da empresa.Desejável Noções em JavaScript (JQuery).,
56,Vagas de emprego: Digital Republic,Digital Republic,"São Paulo, SP",,Postedhá 24 dias,2022-05-06,Posição para atuar em projetos internacionais de alta visibilidade para empresas de diversos portes e segmentos. Aplique seus conhecimentos em projetos…,
57,Vagas de emprego: Kikker,Kikker,"São Paulo, SP",R$ 2.000 - R$ 4.000 por mês,Postedhá 24 dias,2022-05-06,Desejável Conhecimento em Git; Conhecimento em consumo de APIs; Compreensão de inglês técnico.,
58,Vagas de emprego: Cloudbeds,Cloudbeds,"Home office in São Paulo, SP",,PostedHoje,2022-05-06,"We create advanced cloud-based hospitality software for hotels, hostels, and hotel groups that manages reservations and guests, distributes room availability,…",
59,Vagas de emprego: Pagaleve,Pagaleve,"São Paulo, SP",,Postedhá 8 dias,2022-05-06,Você também vai interagir com o time de engenharia para fornecer insights e ideias para melhorias na plataforma de tecnologia para agilizar o processo de…,
60,MQ Distribuída - Analista de Suporte Técnico - Pleno,IBM,"São Paulo, SP",,PostedHoje,2022-05-06,"Na IBM, o trabalho é mais que uma tarefa.É um chamado para construir.Fornecer solução de problemas e aconselhamento técnico para clientes da IBM.",https://www.br.indeed.com/rc/clk?jk=408a9317200e3c50&fccid=de71a49b535e21cb&vjs=3
61,Estagiário Desenvolvimento WEB Front-End,Class Solutions,"São Paulo, SP",,Postedhá 30 dias,2022-05-06,Atuará em atividades de Desenvolvimento de Soluções de web Front End para soluções Internas de empresas clientes.,https://www.br.indeed.com/rc/clk?jk=d0fca9b9786d6d59&fccid=d12ef9849a0516b7&vjs=3
62,Desenvolvedor(a) Front-End,E4 Agência,"São Paulo, SP",,Postedhá 17 dias,2022-05-06,Requisitos Experiência com Wordpress; Tecnologias Front-End; Conhecimento sobre plugins shortcodes; Domínio sobre HTML e CSS; Conhecimento sobre javascript;…,https://www.br.indeed.com/rc/clk?jk=f44fbb182bab7b5d&fccid=df3a352d689a2d41&vjs=3
63,Desenvolvedor Web,Evoi Publicidade,"São Paulo, SP",R$ 2.100 por mês,EmployerAtiva 3 dias atrás,2022-05-06,Colaborar com automação de processos em plataformas de marketing.,https://www.br.indeed.com/company/Evoi-Publicidade/jobs/Desenvolvedor-Web-63684da59c48070e?fccid=37fc7b0ef9000391&vjs=3
64,Product Designer,JOTA Jornalismo SA,"Home office in São Paulo, SP",,Postedhá 16 dias,2022-05-06,O JOTA está em busca de um/a product designer para integrar o squad de desenvolvimento do portal do JOTA.Escrever histórias dos usuários a partir da geração de…,https://www.br.indeed.com/rc/clk?jk=b32a5c39bf808d41&fccid=c4cc0c67dd7dd43c&vjs=3
65,"Fullstack Node/Vue.js Developer - Júnior [Remoto, Brasil]",Martin Luz,"Home office in São Paulo, SP",R$ 3.500 - R$ 4.000 por mês,PostedHoje,2022-05-06,"Contribuir com o desenvolvimento de um novo produto, basicamente do zero;Sempre procuram aprender mais sobre tecnologia;",https://www.br.indeed.com/rc/clk?jk=842617ed95f79d06&fccid=f5ba7c505cbe31c3&vjs=3
66,Desenvolvedor(a) Web Front-End,Focus Têxtil,"São Paulo, SP",,Postedhá 17 dias,2022-05-06,"Desejável jQuery; Angular; SASS ou LESS (básico); Bibliotecas javascript; Conhecimentos em manipulação de PDF, excel, ou imagens com javascript client-side;…",https://www.br.indeed.com/rc/clk?jk=578b6386f803c50d&fccid=0cca2d07c13c31e9&vjs=3
67,Desenvolvedor(a) Front-end (remoto) HTML,GeekHunter,"Home office in São Paulo, SP",R$ 3.500 - R$ 4.000 por mês,Postedhá 22 dias,2022-05-06,"Interacao com time de backend.Experiencia com HTML, Javascript (React) e CSS.Desenvolvimento de paginas/dashboards responsivas, compatibilidade multi-browser…",https://www.br.indeed.com/rc/clk?jk=9272fb366c0e6d8c&fccid=9ba8dec3013c0c90&vjs=3
68,Pessoa Desenvolvedora Front-end,Webjump,"Home office in São Paulo, SP",,Postedhá 30+ dias,2022-05-06,"Conhecimento/experiência em JavaScript, HTML5, CSS3;Experiência com ferramentas de versionamento de código (GIT, por exemplo);",https://www.br.indeed.com/rc/clk?jk=c744ede20363f2f8&fccid=55e0ac93fb8b211b&vjs=3
69,Desenvolvedor Front End - Todo o Brasil,Grupo DPSP – Drogarias Pacheco São Paulo,"Home office in São Paulo, SP",,Postedhá 30+ dias,2022-05-06,Nosso escritório está localizado na Vila Leopoldina (Zona Oeste) - próximo à estação Villa Lobos – Jaguaré.,https://www.br.indeed.com/rc/clk?jk=70fc812e514f683b&fccid=d88bd850b48fcb49&vjs=3
70,Estagiário de Dados,BEGREEN FAZENDAS URBANAS LTDA,"Home office in São Paulo, SP",,EmployerAtiva 1 dia atrás,2022-05-06,"Somos a BeGreen, a primeira fazenda urbana da América da Latina.Conhecimento com ferramentas de visualização de dados (Tableau, Qlik Sense, Data Studio, Power…",https://www.br.indeed.com/company/Begreen-fazendas-urbanas-Llda/jobs/Estagi%C3%A1rio-Dados-54cfd62ba83529ea?fccid=cb0ac5611980afed&vjs=3
71,IT Developer,Santander,"São Paulo, SP",,Postedhá 1 dia,2022-05-06,Linguagem de programação Java 8 > ;Construção de aplicações WEB baseada em micro serviços;Framework Spring Boot e CAMEL;,https://www.br.indeed.com/rc/clk?jk=3985d759104ee184&fccid=e57a47a3d1d90e39&vjs=3
72,Desenvolvedor Front-End - Hibrida #408,iBlue Consulting,"São Paulo, SP",,Postedhá 24 dias,2022-05-06,Trabalhar junto com o squad para garantir que a melhor solução será implementada;Garantir alta qualidade da plataformas e consistência com a marca;,https://www.br.indeed.com/rc/clk?jk=0f88518349f431de&fccid=cd699d24e4f5fb6c&vjs=3
73,Desenvolvedor(a) Wordpress,INTRANET MALL,"São Paulo, SP",,Postedhá 6 dias,2022-05-06,Estamos com uma vaga em aberta para Desenvolver Wordpress.,https://www.br.indeed.com/rc/clk?jk=f0b1a69525d43f24&fccid=10eaa303fb5c21ab&vjs=3
74,Desenvolvedor Front-End,W5 Publicidade,"São Paulo, SP",,Postedhá 30+ dias,2022-05-06,"Diagramar os projetos seguindo o layout.Experiência comprovada na área (3 a 6 anos).Experiência comprovadas com JavaScript, Jquery, HTML e CSS.",https://www.br.indeed.com/rc/clk?jk=3d8350053b1abaac&fccid=d33cb707b0ff8482&vjs=3
75,Desenvolvedor(a) Wordpress,INTRANET MALL,"São Paulo, SP",,Postedhá 6 dias,2022-05-06,Estamos com uma vaga em aberta para Desenvolver Wordpress.,https://www.br.indeed.com/rc/clk?jk=f0b1a69525d43f24&fccid=10eaa303fb5c21ab&vjs=3
76,Desenvolvedor Front-End,W5 Publicidade,"São Paulo, SP",,Postedhá 30+ dias,2022-05-06,"Diagramar os projetos seguindo o layout.Experiência comprovada na área (3 a 6 anos).Experiência comprovadas com JavaScript, Jquery, HTML e CSS.",https://www.br.indeed.com/rc/clk?jk=3d8350053b1abaac&fccid=d33cb707b0ff8482&vjs=3
77,Desenvolvedor Front-end,Matrix Energia,"São Paulo, SP",,Postedhá 30+ dias,2022-05-06,"Experiência em tecnologias como HTML, Javascript, HTML5, CSS3 , Bootstrap e Typescript;Experiência em frameworks de Front-end como React, Angular, JQuery e Vue…",https://www.br.indeed.com/rc/clk?jk=d3b1213db1a57cd5&fccid=ecbe529b7fab5e39&vjs=3
78,JavaScript Developer,DNA325,"São Paulo, SP",R$ 19.500 por mês,EmployerAtiva 8 dias atrás,2022-05-06,"This includes optimizing applications, ensuring UI/UX feasibility, and implementing API designs and architecture.Full-stack web development experience;",https://www.br.indeed.com/company/DNA325/jobs/Javascript-Developer-c728735bf709d10b?fccid=dfe8e6d9e7370cb0&vjs=3
79,Programador PHP PLENO,Maxnivel Tecnologia Ltda,"Home office in São Paulo, SP",R$ 6.000 - R$ 8.000 por mês,EmployerAtiva 7 dias atrás,2022-05-06,Experiência em php e mysql javascript orientação a objeto.Atuação em atividades de programação de software.,https://www.br.indeed.com/company/Maxnivel-Tecnologia-Ltda/jobs/Programador-PHP-Pleno-b7f0c654593af7b0?fccid=ed27e511a224a841&vjs=3
80,Pessoa Desenvolvedora Junior,Zarpo Viagens,"Home office in São Paulo, SP",,Postedhá 30+ dias,2022-05-06,Tornar o mundo um lugar melhor é nosso desejo.Desenvolver novos recursos e oferecer suporte para diferentes aplicações da Zarpo;,https://www.br.indeed.com/rc/clk?jk=abf8dac697746150&fccid=05c5f328763329d0&vjs=3
81,Designer Pleno,CIA Hering,"Home office in São Paulo, SP",,Postedhá 18 dias,2022-05-06,"Criação de peças de mídia externa para veiculação de Google, Facebook, criteo, entre outros.Ensino Superior Completo em Publicidade e Propaganda, Marketing,…",https://www.br.indeed.com/rc/clk?jk=1553747f324fd0b6&fccid=a76c73cacfc7a3e6&vjs=3
82,"Code Reviewer (HTML, CSS, JavaScript, React, Node.js)",Practicum,"Home office in São Paulo, SP",,Postedhá 16 dias,2022-05-06,All communication with students is through text and in the English language.1.5+ years of work experience as a full-stack web developer.,https://www.br.indeed.com/company/Practicum-by-Yandex/jobs/Code-Reviewer-56e35ed6e67d9ce3?fccid=3fa72a17b3354e40&vjs=3
83,Desenvolvedor de Sistemas III - Berrini SP,Atento Brasil,"São Paulo, SP",R$ 6.500 por mês,Postedhá 9 dias,2022-05-06,Ser proativo e participativo entregando com qualidade e dentro dos prazos previstos.Implementar interfaces garantindo a utilização de boas práticas no…,https://www.br.indeed.com/rc/clk?jk=77f2bf8c1d8bba31&fccid=28ba5f1b6307faa6&vjs=3
84,Research Scientist,IBM,"São Paulo, SP",,Postedhá 3 dias,2022-05-06,"IBM Research Brazil is hiring researchers and experienced software engineers for its Knowledge-centric Systems group, which pursues research aimed at advancing…",https://www.br.indeed.com/rc/clk?jk=1926163258512a9f&fccid=de71a49b535e21cb&vjs=3
85,Assistente de Serviços de TI,Experian,"Zona Sul de São Paulo, SP",,Postedhá 3 dias,2022-05-06,"Vivenciamos um momento de transformação digital e procuramos talentos que desejam ensinar, aprender e transformar junto com nosso time de Tecnologia.",https://www.br.indeed.com/rc/clk?jk=533110e907cf7e6c&fccid=75a3a5a15b202084&vjs=3
86,Analista de Sistemas,INSTITUTO MONITOR,"São Paulo, SP",R$ 3.000 - R$ 6.000 por mês,Postedhá 17 dias,2022-05-06,"Ensino superior, cursando ou concluído, em Sistemas.NET, C#, Web API e Modelagem de dados.Desejável Javascript, SQL e MySQL Diferencial PowerBI.",https://www.br.indeed.com/company/INSTITUTO-MONITOR/jobs/Analista-Sistemas-7ec399ad457a9958?fccid=c9bdbabccaf2a253&vjs=3
